{
  "$schema": "../config/mo-config.schema.json",
  "project": {
    "name": "my-project",
    "primaryRepo": "/absolute/path/to/your/repo"
  },
  "planStore": "/absolute/path/to/your/plans-dir",
  "commands": {
    "test": "pnpm test",
    "typecheck": "pnpm typecheck",
    "archLint": ""
  },
  "base": {
    "default": "main"
  }
}
